{
  "schema_version": "https://github.com/lucashgrifoni/OSS-Security-Policy-as-Code-Starter-Kit/reports/2.0",
  "contract_version": "reports/2.0",
  "evidence_provenance_version": "evidence/2.0",
  "generated_at": "2026-08-06T00:00:00+00:00",
  "kit_version": "10.0.15",
  "target_path": "hardened-repo",
  "profile": {
    "id": "github-level-1",
    "title": "GitHub OSS starter baseline (level 1)",
    "family": "github",
    "level": "L1",
    "posture": "starter",
    "is_release_track": false,
    "recommended_gate": "--fail-on fail"
  },
  "summary_by_status": {
    "PASS": 14
  },
  "controls_total": 14,
  "controls": [
    {
      "id": "GOV-SEC-001",
      "title": "SECURITY.md present",
      "category": "governance",
      "lifecycle": "stable",
      "profile": "github-level-1",
      "state": "PASS",
      "assurance": "deterministic",
      "confidence": "high",
      "weight": 3,
      "message": "SECURITY.md present.",
      "remediation": "Keep SECURITY.md current and linked from the repository README.",
      "evidence": {
        "source_type": "static_clone",
        "trust_level": "declared",
        "collection_method": "static",
        "collected_at": null,
        "source_platform": "local",
        "freshness_status": "not_applicable",
        "attestation_status": "none",
        "references": [
          {
            "kind": "path",
            "value": "<redacted-absolute>/SECURITY.md",
            "redacted": true
          }
        ],
        "limitations": [],
        "digest": null,
        "evidence_schema_id": null
      },
      "owner": null,
      "expires_at": null,
      "waiver": null,
      "extra": {},
      "finding_id": "GOV-SEC-001@github-level-1"
    },
    {
      "id": "GOV-CON-002",
      "title": "CONTRIBUTING guide present",
      "category": "governance",
      "lifecycle": "stable",
      "profile": "github-level-1",
      "state": "PASS",
      "assurance": "deterministic",
      "confidence": "high",
      "weight": 1,
      "message": "Contributing guide present.",
      "remediation": "Keep contribution expectations and security expectations aligned.",
      "evidence": {
        "source_type": "static_clone",
        "trust_level": "declared",
        "collection_method": "static",
        "collected_at": null,
        "source_platform": "local",
        "freshness_status": "not_applicable",
        "attestation_status": "none",
        "references": [
          {
            "kind": "path",
            "value": "<redacted-absolute>/CONTRIBUTING.md",
            "redacted": true
          }
        ],
        "limitations": [],
        "digest": null,
        "evidence_schema_id": null
      },
      "owner": null,
      "expires_at": null,
      "waiver": null,
      "extra": {},
      "finding_id": "GOV-CON-002@github-level-1"
    },
    {
      "id": "GOV-COWN-003",
      "title": "CODEOWNERS configured",
      "category": "governance",
      "lifecycle": "stable",
      "profile": "github-level-1",
      "state": "PASS",
      "assurance": "deterministic",
      "confidence": "high",
      "weight": 2,
      "message": "CODEOWNERS file present.",
      "remediation": "Review CODEOWNERS coverage for critical paths.",
      "evidence": {
        "source_type": "static_clone",
        "trust_level": "declared",
        "collection_method": "static",
        "collected_at": null,
        "source_platform": "local",
        "freshness_status": "not_applicable",
        "attestation_status": "none",
        "references": [],
        "limitations": [],
        "digest": null,
        "evidence_schema_id": null
      },
      "owner": null,
      "expires_at": null,
      "waiver": null,
      "extra": {},
      "finding_id": "GOV-COWN-003@github-level-1"
    },
    {
      "id": "GOV-LIC-004",
      "title": "LICENSE file present",
      "category": "governance",
      "lifecycle": "stable",
      "profile": "github-level-1",
      "state": "PASS",
      "assurance": "deterministic",
      "confidence": "high",
      "weight": 1,
      "message": "LICENSE (or COPYING) file detected.",
      "remediation": "Ensure LICENSE matches declared SPDX and distribution intent.",
      "evidence": {
        "source_type": "static_clone",
        "trust_level": "declared",
        "collection_method": "static",
        "collected_at": null,
        "source_platform": "local",
        "freshness_status": "not_applicable",
        "attestation_status": "none",
        "references": [],
        "limitations": [],
        "digest": null,
        "evidence_schema_id": null
      },
      "owner": null,
      "expires_at": null,
      "waiver": null,
      "extra": {},
      "finding_id": "GOV-LIC-004@github-level-1"
    },
    {
      "id": "CI-WF-005",
      "title": "GitHub Actions workflows exist",
      "category": "ci_cd",
      "lifecycle": "stable",
      "profile": "github-level-1",
      "state": "PASS",
      "assurance": "deterministic",
      "confidence": "high",
      "weight": 2,
      "message": "Found 3 workflow file(s).",
      "remediation": "Keep CI workflows minimal, pinned, and least-privilege.",
      "evidence": {
        "source_type": "static_clone",
        "trust_level": "declared",
        "collection_method": "static",
        "collected_at": null,
        "source_platform": "local",
        "freshness_status": "not_applicable",
        "attestation_status": "none",
        "references": [
          {
            "kind": "path",
            "value": "<redacted-absolute>/ci.yml",
            "redacted": true
          },
          {
            "kind": "path",
            "value": "<redacted-absolute>/release-example.yml",
            "redacted": true
          },
          {
            "kind": "path",
            "value": "<redacted-absolute>/security.yml",
            "redacted": true
          }
        ],
        "limitations": [],
        "digest": null,
        "evidence_schema_id": null
      },
      "owner": null,
      "expires_at": null,
      "waiver": null,
      "extra": {},
      "finding_id": "CI-WF-005@github-level-1"
    },
    {
      "id": "CI-PERM-006",
      "title": "Workflows declare explicit top-level permissions",
      "category": "ci_cd",
      "lifecycle": "stable",
      "profile": "github-level-1",
      "state": "PASS",
      "assurance": "deterministic",
      "confidence": "medium",
      "weight": 3,
      "message": "All workflows declare top-level permissions.",
      "remediation": "Re-audit permissions when adding new jobs.",
      "evidence": {
        "source_type": "static_clone",
        "trust_level": "declared",
        "collection_method": "static",
        "collected_at": null,
        "source_platform": "local",
        "freshness_status": "not_applicable",
        "attestation_status": "none",
        "references": [],
        "limitations": [],
        "digest": null,
        "evidence_schema_id": null
      },
      "owner": null,
      "expires_at": null,
      "waiver": null,
      "extra": {},
      "finding_id": "CI-PERM-006@github-level-1"
    },
    {
      "id": "CI-DANGER-007",
      "title": "No pull_request_target without strong justification",
      "category": "ci_cd",
      "lifecycle": "stable",
      "profile": "github-level-1",
      "state": "PASS",
      "assurance": "deterministic",
      "confidence": "medium",
      "weight": 3,
      "message": "No pull_request_target detected in workflows.",
      "remediation": "Continue avoiding pull_request_target unless necessary.",
      "evidence": {
        "source_type": "static_clone",
        "trust_level": "declared",
        "collection_method": "static",
        "collected_at": null,
        "source_platform": "local",
        "freshness_status": "not_applicable",
        "attestation_status": "none",
        "references": [],
        "limitations": [],
        "digest": null,
        "evidence_schema_id": null
      },
      "owner": null,
      "expires_at": null,
      "waiver": null,
      "extra": {},
      "finding_id": "CI-DANGER-007@github-level-1"
    },
    {
      "id": "CI-PIN-008",
      "title": "Third-party actions pinned to immutable references",
      "category": "supply_chain",
      "lifecycle": "stable",
      "profile": "github-level-1",
      "state": "PASS",
      "assurance": "deterministic",
      "confidence": "medium",
      "weight": 3,
      "message": "No obvious mutable third-party action pins detected.",
      "remediation": "Re-check when editing workflows; verify transitive action versions.",
      "evidence": {
        "source_type": "static_clone",
        "trust_level": "declared",
        "collection_method": "static",
        "collected_at": null,
        "source_platform": "local",
        "freshness_status": "not_applicable",
        "attestation_status": "none",
        "references": [],
        "limitations": [],
        "digest": null,
        "evidence_schema_id": null
      },
      "owner": null,
      "expires_at": null,
      "waiver": null,
      "extra": {},
      "finding_id": "CI-PIN-008@github-level-1"
    },
    {
      "id": "CI-LEAST-009",
      "title": "Workflow permissions are not obviously over-broad",
      "category": "ci_cd",
      "lifecycle": "stable",
      "profile": "github-level-1",
      "state": "PASS",
      "assurance": "signal",
      "confidence": "medium",
      "weight": 2,
      "message": "No obviously over-broad workflow permissions detected.",
      "remediation": "Review permissions when adding publishing or release jobs.",
      "evidence": {
        "source_type": "heuristic_signal",
        "trust_level": "inferred",
        "collection_method": "static",
        "collected_at": null,
        "source_platform": "local",
        "freshness_status": "not_applicable",
        "attestation_status": "none",
        "references": [],
        "limitations": [